{
  "manifest_id": "dd112233-4455-6677-8899-aabbccddeeff",
  "dataset_id": "a1b2c3d4-e5f6-7890-abcd-ef1234567890",
  "files": [
    {
      "filename": "IMG_0001.tif",
      "size_bytes": 15204352,
      "sha256_hash": "a3f2b8c1d4e5f6a7b8c9d0e1f2a3b4c5d6e7f8a9b0c1d2e3f4a5b6c7d8e9f0a1",
      "mime_type": "image/tiff",
      "captured_at": "2026-03-01T08:15:23Z",
      "gps_lat": 39.9208,
      "gps_lon": 32.8541
    },
    {
      "filename": "IMG_0002.tif",
      "size_bytes": 15198208,
      "sha256_hash": "b4c3d9e2f5a6b7c8d9e0f1a2b3c4d5e6f7a8b9c0d1e2f3a4b5c6d7e8f9a0b1c2",
      "mime_type": "image/tiff",
      "captured_at": "2026-03-01T08:15:26Z",
      "gps_lat": 39.9209,
      "gps_lon": 32.8543
    }
  ],
  "total_hash": "e5f6a7b8c9d0e1f2a3b4c5d6e7f8a9b0c1d2e3f4a5b6c7d8e9f0a1b2c3d4e5f6",
  "created_at": "2026-03-01T08:35:00Z"
}